id,title,cuisine
110679,Grilled Vietnamese Chicken Breasts,Vietnamese
157168,"Vietnamese ""Banh Mi"" Chicken Burger",Vietnamese
540926,Spring Rolls with Sesame Ponzu Vinaigrette,Vietnamese
98839,Spicy Banh Mi,Vietnamese
550157,Vietnamese Bún or Shrimp Vermacelli Dish,Vietnamese
427537,Caribbean Shrimp Spring Rolls,Vietnamese
1114436,Lemongrass Chicken Banh Mi,Vietnamese
1645605,Vietnamese Tomato Salad,Vietnamese
1590551,Shrimp Pho with Vegetables,Vietnamese
1475071,Vietnamese Spring Rolls,Vietnamese
221094,"Pea, feta & quinoa spring rolls with roast tomato nam prik",Vietnamese
37389,Banh Cuon Recipe (steamed Rice Rolls),Vietnamese
891106,Bánh xèo (Vietnamese Happy Pancakes),Vietnamese
195928,Vietnamese Pickled Daikon and Carrots for Banh Mì (Do Chua),Vietnamese
248816,Vietnamese Chili Garlic Sauce,Vietnamese
609947,Vietnamese Caramel Chicken,Vietnamese
761271,"Su Chao San Jiao (Stir-Fried Bamboo Shoots, Cabbage, and Red and Green Peppers in Spicy Bean Sauce)",Vietnamese
478428,How to cook: Vietnamese chicken and pineapple stir fry,Vietnamese
1719013,Vegan Pho - Vietnamese Noodle Soup,Vietnamese
521295,Vietnamese chicken satay with nuoc cham,Vietnamese
98735,Vietnamese grilled pork wrapped in Lettuce,Vietnamese
16724,Spicy Vietnamese Shrimp Lettuce Rolls,Vietnamese
630674,Banh Mi Lettuce Wraps,Vietnamese
678440,Asian Slaw Spring Rolls,Vietnamese
41558,Grilled Tuna Banh Mi,Vietnamese
544742,Shrimp Spring Rolls,Vietnamese
544996,Vietnamese Chicken Salad (Goi Ga),Vietnamese
103277,Vietnamese Sandwich,Vietnamese
1018970,Vietnamese Lemongrass Chicken,Vietnamese
1089254,Vietnamese Pho Bo,Vietnamese
93875,Vietnamese Cabbage,Vietnamese
242896,Vietnamese Salt and Pepper Shrimp Rice Noodle Bowl (Bun Tom Xao),Vietnamese
10138,Vietnamese Style Beef And Noodle Broth Recipe,Vietnamese
589749,Vietnamese Cinnamon Rolls – The Quest,Vietnamese
762957,Low Carb Avocado Spring Rolls,Vietnamese
883087,Green Curry Ramen Spring Rolls,Vietnamese
41476,Vietnamese Rolls,Vietnamese
829914,Sous Vide Pork Loin Banh Mi Buns,Vietnamese
38153,White Asparagus Salad Recipe (goi Mang),Vietnamese
1096211,The Easiest Beef Pho,Vietnamese
1166677,Instant Pot Banh Mi Sliders,Vietnamese
312791,Baked Spring Rolls with Crab,Vietnamese
93746,Vegetarian Spring Rolls,Vietnamese
598755,Spiced Lamb Burgers with Vietnamese Herb Salad,Vietnamese
960246,Vietnamese Banh Mi Meatballs – Low Carb,Vietnamese
136815,Grilled Vietnamese Chicken,Vietnamese
1089876,Vietnamese Kho Style Chicken,Vietnamese
94371,Crunchy Vietnamese Chicken Salad,Vietnamese
560458,Pork and Mushrooms Spring Rolls,Vietnamese
163819,Banh Mi Chicken Burger,Vietnamese
92009,Cold Soba Noodles with Vietnamese Pork,Vietnamese
119321,Vietnamese Pickled Carrots and Daikon Radish,Vietnamese
478281,Banana and chunky peanut butter spring rolls,Vietnamese
589912,Video Vietnamese Stuffed Squid & Wine Blogging Wednesday,Vietnamese
41547,Lemongrass Tofu Banh Mi,Vietnamese
17932,Shrimp Spring Rolls,Vietnamese
886221,20-Minute Chicken Pho,Vietnamese
1087915,Vietnamese chicken noodle soup,Vietnamese
918033,Chicken Spring Rolls,Vietnamese
336160,Open-Face Vietnamese Chicken Sandwiches,Vietnamese
23455,Vietnamese Grilled Chicken and Eggplant,Vietnamese
664847,Vietnamese Spring Rolls,Vietnamese
1439947,Crispy Lumpia (Filipino Lumpiang Shanghai Spring Rolls),Vietnamese
676158,Banana Spring Rolls,Vietnamese
780017,The (Lemon)grass is Always Greener: Lemongrass Tofu Banh Mi Sandwiches,Vietnamese
75957,Crispy Spring Rolls With Herb Salad,Vietnamese
319164,Shrimp Spring Rolls with Spicy Apricot Mustard Dip,Vietnamese
907693,Vietnamese-Style Noodle Bowls with Chicken,Vietnamese
16770,Bacon Lettuce Tomato (blt) Spring Roll,Vietnamese
644859,Gluten Free Vegetarian Spring Rolls With Thai-Style Peanut Sauce,Vietnamese
246082,Vietnamese Summer Rolls,Vietnamese
20912,Vietnamese Chicken Salad (Goi Ga),Vietnamese
41453,Vietnamese Fried Egg Banh Mi Recipe (banh Mi Trung Op La)- “the,Vietnamese
478546,How to cook: Vietnamese chicken satay with nuoc cham,Vietnamese
1100081,Crispy Chicken Banh Mi Bowls,Vietnamese
1126107,Pho (Vietnamese Noodle Soup),Vietnamese
397383,Vietnamese Egg Sandwiches,Vietnamese
98808,Vietnamese Beef Wraps,Vietnamese
1591073,Easy Vegan Pho,Vietnamese
5902,Caramel Shrimp (Vietnamese Tom Rim),Vietnamese
99341,Vietnamese Pork Balls With Hot and Sour Dipping Sauce,Vietnamese
54946,Vietnamese Iced Coffee Milkshake,Vietnamese
1712327,Smoky and Crunchy Peas With Creamy Nuoc Cham,Vietnamese
481782,PRAWN AND AVOCADO LETTUCE WRAPS with NUOC CHAM,Vietnamese
379144,Crab Spring Rolls,Vietnamese
478413,"Sweet and tangy pork, water spinach (kangkong) and pineapple spring rolls",Vietnamese
92161,Quick 'n Easy Vietnamese Chicken Salad,Vietnamese
1600903,Instant Pot Beef Pho,Vietnamese
1010037,Instant Pot Pho,Vietnamese
41528,Grilled Chicken Banh Mi,Vietnamese
144485,Thai Spring Rolls (Pa Pia),Vietnamese
1458385,Spring Roll Bowls with Grilled Chicken,Vietnamese
1000958,Banh Xeo (Bánh Xèo) – Savory Vietnamese Crêpe,Vietnamese
739696,"Crab Spring Rolls with Pink Grapefruit, Avocado and Toasted Almonds",Vietnamese
293307,Shrimp Spring Rolls,Vietnamese
122333,Spring Rolls with Crab,Vietnamese
83730,Vietnamese Chicken Noodle Soup,Vietnamese
1458241,Shrimp and Sugar Snap Pea Bánh Xèo (Vietnamese Sizzling Rice Crepes),Vietnamese
755363,Vegetarian Spring Rolls,Vietnamese
890002,Fresh and Easy Vietnamese Noodle Salad,Vietnamese
499049,Chicken Meatball Soup With Vietnamese Flavors,Vietnamese
527305,Vietnamese Pho Soup,Vietnamese
248417,Vietnamese Noodle Bowl,Vietnamese
757311,Vegetarian Pho,Vietnamese
746342,Naked Spring Rolls,Vietnamese
586630,Vietnamese Braised Beef over Rice Noodle Salad,Vietnamese
478405,How to cook: Lumpiang ubod (heart of palm spring rolls),Vietnamese
34458,Bun Chay (vietnamese Vegetarian Noodle Salad),Vietnamese
1090106,Vietnamese Prawn Pho,Vietnamese
582778,Grilled Eggplant Banh Mi Sandwich,Vietnamese
756990,Paleo Fresh Spring Rolls,Vietnamese
520721,"Gingered pork, chicken and egg braised in Vietnamese nuoc cham",Vietnamese
91367,Spring Rolls with Carrot-Ginger Dipping Sauce,Vietnamese
249202,Spicy Pork Bulgogi Banh Mi,Vietnamese
948031,Easy Banh Mi Sandwiches,Vietnamese
40539,Vietnamese Ginger Crab,Vietnamese
113771,Pho (Vietnamese Beef and Noodle Soup),Vietnamese
672634,Vietnamese Fresh Spring Rolls,Vietnamese
645634,Grilled Chicken Banh Mi,Vietnamese
553732,Pork Tenderloin Spring Rolls,Vietnamese
584361,"Shrimp, California Avocado & Rice Noodle Spring Rolls",Vietnamese
2566,Ceviche Spring Rolls,Vietnamese
17676,Banh Mi-style Chicken Sandwich,Vietnamese
717628,Vegetarian Pho,Vietnamese
625228,Garlic-Brined Pork Banh Mi,Vietnamese
802393,Slow Cooker Chicken Pho,Vietnamese
478770,Scrap ham spring rolls,Vietnamese
630115,Quick beef pho - delicious. magazine,Vietnamese
826424,Quick Beef & Napa Cabbage Pho,Vietnamese
211422,Vietnamese veg parcels,Vietnamese
41530,Spring Rolls With Carrot-ginger Dipping Sauce,Vietnamese
1110825,Vegetable Spring Rolls,Vietnamese
1604959,Weeknight Ginger Chicken Pho,Vietnamese
1605941,Weeknight Ginger Chicken Pho (Vietnamese Chicken Soup),Vietnamese
1091998,Vietnamese pork & peanut burgers,Vietnamese
515932,Crispy Baked Chicken Spring Rolls,Vietnamese
479961,Vietnamese Lamb Meatball Sandwiches,Vietnamese
863471,Instant Pot Pho,Vietnamese
1070301,Vietnamese Braised Short Ribs,Vietnamese
883958,Shrimp Spring Rolls with Peanut Sauce,Vietnamese
34451,Vietnamese Shrimp Summer Rolls,Vietnamese
583898,Chicken Pho,Vietnamese
760276,Vietnamese Hot-Pot Fondue,Vietnamese
87802,Salmon Steak in Caramel Sauce (Vietnamese Ca Kho),Vietnamese
113632,Vegetarian Pho,Vietnamese
1659839,20-Minute Chicken Pho,Vietnamese
697889,Shrimp-Filled Spring Rolls,Vietnamese
20971,Bun Mang Ga (Vietnamese Bamboo Shoots and Chicken Vermicelli Rice Noodle Soup),Vietnamese
621574,Vietnamese Lemongrass Grilled Chicken Salad,Vietnamese
289991,Vietnamese Grilled Smoked Pork Chop Rice Bowls,Vietnamese
41487,Vietnamese Chicken Sandwich (Banh Mi),Vietnamese
91905,Cold Vegetarian Spring Rolls,Vietnamese
1532541,"Vietnamese Chickpea, Sweet Potato, and Lemongrass Curry",Vietnamese
874281,Pork Spring Rolls,Vietnamese
34494,Vietnamese Spring Rolls (cha Gio) Recipe,Vietnamese
6031,Vietnamese BBQ Shrimp Vermicelli,Vietnamese
359842,Chicken and Vegetable Spring Rolls,Vietnamese
41628,Vietnamese Grilled Chicken with Vermicelli Noodles (Bun Ga Nuong),Vietnamese
914853,Vietnamese Beef Noodle Salad: Pho Tron,Vietnamese
677015,Vietnamese Chicken and Cabbage Salad,Vietnamese
1421019,Vietnamese Grilled Pork with Noodles – Bún Thịt Nướng,Vietnamese
94352,Chicken Spring Rolls,Vietnamese
602462,Chinese Chicken Spring Rolls,Vietnamese
1018715,Shrimp and Veggie Spring Rolls,Vietnamese
343492,Shrimp Spring Rolls with Peanut Dipping Sauce,Vietnamese
894663,Pork with Nuoc Cham,Vietnamese
506972,Skinny Vietnamese Steak Salad,Vietnamese
922295,Shrimp Spring Roll Noodle Bowls,Vietnamese
94259,Baked Chicken Spring Rolls,Vietnamese
58695,"Fresh Spring Rolls with Pork, Mango, and Mesclun",Vietnamese
850161,Bun Cha: Vietnamese Pork Meatballs,Vietnamese
85935,Ca Kho to (Vietnamese Fish in Caramel Sauce),Vietnamese
1147036,Vietnamese Lettuce Wraps with BBQ Pork Meatballs,Vietnamese
41499,Vegetarian Banh Mi,Vietnamese
880914,Tofu Spring Rolls,Vietnamese
621366,Portobello Mushroom Banh Mi with Sriracha Mayonnaise {vegetarian},Vietnamese
41444,Vietnamese Pickled Carrot And Daikon Recipe,Vietnamese
197219,Country Pâté Banh Mi,Vietnamese
613485,Essential Everyday : Shrimp Spring Rolls,Vietnamese
1122002,Shrimp Spring Rolls with Peanut Dipping Sauce,Vietnamese
478246,"Pork patty, herbs & arugula spring rolls",Vietnamese
801847,Chicken Banh Mi Pizza,Vietnamese
854016,Vietnamese Meatball and Sweet Potato Noodle Bowl,Vietnamese
80067,Crispy Ham Spring Rolls With A Soy Ginger Dipping Sauce,Vietnamese
589024,Vietnamese carrot salad,Vietnamese
334546,Fruit Spring Rolls,Vietnamese
74372,Vietnamese Lemongrass Chicken,Vietnamese
197613,Hoi An-style Oven-crisped Pork Sandwich (Banh Mi Thit Hoi An),Vietnamese
408455,Vietnamese Pork Lettuce Wraps,Vietnamese
521363,(Vietnamese style) Honey ginger chicken,Vietnamese
219215,Wrap-your-own spring rolls,Vietnamese
204533,Crispy Pork Spring Rolls,Vietnamese
968821,Vietnamese-Style Sticky Chicken Skewers,Vietnamese
118678,Vietnamese clay pot pork,Vietnamese
5715,Vietnamese Sugar Cane Shrimp (chao Tom),Vietnamese
275468,Pho,Vietnamese
149983,Vietnamese Chicken Salad,Vietnamese
1130899,Lemongrass Chicken Banh Mi,Vietnamese
150356,Pork Meatball Banh Mi,Vietnamese
1084887,Vegan Spring Rolls with Peanut Sauce,Vietnamese
666103,Summer Fruit Spring Rolls,Vietnamese
476400,Vietnamese Meatballs,Vietnamese
87822,Vietnamese-Style Fresh Spring Rolls With Salmon,Vietnamese
369999,Pork Spring Rolls,Vietnamese
169640,Pork Banh Mi,Vietnamese
584487,Vietnamese Caramel Ginger Chicken (Ga Kho),Vietnamese
664708,Vegetarian Spring Rolls With Garlic Lime Sauce,Vietnamese
568369,Lumpia Shanghai (Meat-filled Spring Rolls),Vietnamese
1586415,Fresh Spring Rolls,Vietnamese
530787,Lemongrass Beef Banh Mi,Vietnamese
844480,Banh Mi Avocado Toast,Vietnamese
1172289,Vietnamese Tomato Fish with Dill (Cá Sốt Cà Chua),Vietnamese
167999,Veggie-Fish Spring Rolls with Dipping Sauce,Vietnamese
239363,Vietnamese Chicken Sandwiches,Vietnamese
695294,Banh Mi Hot Dog,Vietnamese
93330,Vietnamese Chicken Salad,Vietnamese
1086528,Vegan banh mi,Vietnamese
225013,Vietnamese seafood salad,Vietnamese
793829,Grilled Vietnamese Lemongrass Cilantro Chicken,Vietnamese
321532,Vietnamese,Vietnamese
34441,Banh Xeo (vietnamese Crepes) With Tofu,Vietnamese
589591,Nail Shop Eats- Vietnamese Chicken Cabbage Salad Competition,Vietnamese
666509,Baked Tofu Banh Mi,Vietnamese
93340,Spring Rolls,Vietnamese
43254,Fresh Spring Rolls with Hoisin-Peanut Dip (Goi Cuon),Vietnamese
1055772,Roasted Sweet Potato Spring Rolls with Spinach,Vietnamese
85073,Pork and Shrimp Spring Roll (Goi Cuon) With Peanut Sauce (Nuoc L,Vietnamese
148440,Nuoc Cham (spring roll sauce),Vietnamese
102959,Turkey Banh Mi,Vietnamese
92002,Steamed Spring Rolls,Vietnamese
602205,Crock Pot Pho,Vietnamese
480005,Pho Bo (Vietnamese Beef and Noodle Soup) for,Vietnamese
589063,Vietnamese springrolls,Vietnamese
766343,Veggie Spring Rolls with Thai Mango Dipping Sauce,Vietnamese
615963,Easy Banh Mi Sandwiches,Vietnamese
209115,Dinner Tonight: Vietnamese Rice Noodle Salad,Vietnamese
1731125,Vegan Banh Mi Bowls,Vietnamese
41577,Vietnamese Steak Sandwich,Vietnamese
2294,Cha Ca Thang Long : Vietnamese Dill Fish with Turmeric,Vietnamese
99240,Vietnamese Salad,Vietnamese
156452,Pho,Vietnamese
37089,Pho,Vietnamese
602260,Vietnamese Pho: Beef Noodle Soup,Vietnamese
93966,Vietnamese Chicken and Mint Salad,Vietnamese
471669,Vietnamese Chicken Salad,Vietnamese
37203,Vietnamese Rice Noodle Soup with Beef,Vietnamese
1188109,Vietnamese Avocado Smoothie (Sinh Tố Bơ),Vietnamese
200096,Vietnamese Caramelized Pork and Rice Noodle Salad,Vietnamese
1095994,Crock Pot Chicken Pho,Vietnamese
589904,Vietnamese Spring Rolls – Pineapple Salad – In Two Ways,Vietnamese
94306,Cold Soba Noodles with Vietnamese Pork,Vietnamese
1594783,Gluten-Free Vegan Spring Rolls with Spicy Peanut Sauce,Vietnamese
589887,Vietnamese Spring Rolls – Pineapple Salad – In Two Ways,Vietnamese
1094947,Steak & Vietnamese noodle salad,Vietnamese
619292,Chile-Marinated Pork with Vietnamese Brussels Sprouts,Vietnamese
98783,Neua Nam Tok (Vietnamese Grilled Beef Salad),Vietnamese
493274,Grilled Vietnamese Shrimp Noodle Bowl,Vietnamese
347498,Vietnamese Couscous Salad,Vietnamese
706506,Vietnamese Tilapia with Turmeric and Dill,Vietnamese
121831,Banh Mi-Style Roast Beef Sandwiches,Vietnamese
591069,Banh Mi Chicken Salad Sandwiches,Vietnamese
1486211,Vietnamese Turmeric Fish Summer Rolls,Vietnamese
551749,Vietnamese Banh Mi Sandwich,Vietnamese
121782,Banh Mi–Style Roast Beef Sandwiches,Vietnamese
107141,{Sweet Chili} Roasted Sweet Potato Spring Rolls,Vietnamese
759639,Jasmine Risotto Spring Rolls with Vanilla Dipping Sauce,Vietnamese
40187,Fragrant Pho Noodle Bowl,Vietnamese
5968,Vietnamese Noodle Salad with Lemongrass Shrimp,Vietnamese
40759,Spring Rolls,Vietnamese
1510157,Banh Mi Tacos with Grilled Pork,Vietnamese
150444,Lemongrass Pork with Vietnamese Table Salad,Vietnamese
1647201,Fresh Spring Rolls with Spicy Peanut Sauce,Vietnamese
23152,Leftover Turkey Spring Rolls,Vietnamese
92741,Veggie Spring Rolls,Vietnamese
383610,Baked Spring Rolls,Vietnamese
1087580,Beef pho,Vietnamese
697721,Vietnamese Sandwiches,Vietnamese
557481,Avocado Egg Salad Spring Rolls,Vietnamese
363306,Banh-mi Wrap: Vietnamese Grilled Pork Wrap with Pickled Carrots and Mint,Vietnamese
955627,Vietnamese Beef Stew (Bo Sot Vang),Vietnamese
158572,Easy Baked Spring Rolls,Vietnamese
203156,Serious Eats' Bacon Banh Mi,Vietnamese
6014,Sugar Cane Skewered Shrimp (chao Tom),Vietnamese
41533,Grilling: Vietnamese Meatball Banh Mi,Vietnamese
2271,"Vietnamese Turmeric Fish with Rice Noodles, Dill and Nuoc Cham",Vietnamese
197890,Spam and Pineapple Spring Rolls with Homemade Sweet and Sour Sauce,Vietnamese
697293,Stir-Fry of Pork with Vietnamese Flavors,Vietnamese
276045,Crunchy Spring Roll Wrap,Vietnamese
102953,Bun (Vietnamese Herb Noodle Salad),Vietnamese
823891,Homemade Beef Spring Rolls,Vietnamese
690301,Shanghai-Style Spring Rolls,Vietnamese
41588,Vietnamese Grilled Pork Sandwiches,Vietnamese
478240,Spring rolls with braised beef and herbs,Vietnamese
1422857,Spring Rolls,Vietnamese
307199,Vietnamese Pork Sandwich,Vietnamese
483258,Vietnamese Shrimp Salad,Vietnamese
626566,Vietnamese Chicken Noodle Soup,Vietnamese
90343,Vietnamese Beef and Rice Noodle Salad,Vietnamese
83881,Chicken Satay Banh Mi,Vietnamese
707220,Banh Mi Hot Dog,Vietnamese
380486,Vietnamese Noodle Soup,Vietnamese
17657,Glass Noodle Stir-fry Spring Rolls,Vietnamese
679671,Easy Pho with Daikon Noodles,Vietnamese
610172,Vietnamese Pan-Seared Strip Steak,Vietnamese
481838,Vietnamese Beef Salad,Vietnamese
482444,Sweet and Salty Vietnamese Beef Salad,Vietnamese
23201,Vietnamese Salad Rolls With Peanut Dipping Sauce,Vietnamese
577822,Spring Rolls,Vietnamese
37288,Vietnamese Tofu-noodle Lettuce Wraps,Vietnamese
248289,Spring Rolls with Peanut Sauce,Vietnamese
474443,Vietnamese Chicken Noodle Soup – Donna Hay – 50 Women Game Changers In Food,Vietnamese
23362,Spring Rolls,Vietnamese
549434,Banh Mi Asian Burgers,Vietnamese
198619,Vietnamese Sirloin Skewers With Spicy Carrot Salad,Vietnamese
220996,Vietnamese chicken salad,Vietnamese
198119,Goi Buoi (Vietnamese Pomelo Salad),Vietnamese
824793,Slow Cooker Banh Mi Rice Bowls,Vietnamese
14221,Bo Luc Lac (vietnamese Shaking Beef),Vietnamese
1089847,Vietnamese caramel trout,Vietnamese
15315,Roasted Daikon Radish And Kale Spring Rolls With Tahini-honey D,Vietnamese
563002,Vegetarian Pho,Vietnamese
701797,Pho (Vietnamese Noodle Soup),Vietnamese
40537,Vietnamese Jackfruit Salad Recipe,Vietnamese
230181,Fresh Spring Rolls with Dipping Sauce,Vietnamese
972726,Vietnamese Egg Rolls & Rice Noodles (Bún Chả Giò),Vietnamese
936196,Spiralized Vietnamese Chicken Salad,Vietnamese
754995,Salmon Spring Rolls with Sesame Miso Sauce,Vietnamese
774581,Raw Spring Rolls that Taste Good,Vietnamese
1096250,Pho With Zucchini Noodles,Vietnamese
532689,Grilled Shrimp Vietnamese Spring Rolls,Vietnamese
642129,Easy To Make Spring Rolls,Vietnamese
80253,Goi Chay (vietnamese Vegetarian Salad),Vietnamese
548665,Shrimp Spring Rolls with Peanut Lime Dipping Sauce – 5 Points,Vietnamese
864633,Banh Mi Burgers with Spicy Sriracha Mayo,Vietnamese
629688,Chicken Pho with Daikon Noodles,Vietnamese
610685,Vietnamese Slow Cooker Pho with Beef,Vietnamese
602160,Vietnamese Spring Rolls with Slow Cooker Pork,Vietnamese
590091,"Vietnamese Pickles Carrots & Daikon , My Family",Vietnamese
744939,Grilled Shiitake and Tofu Banh Mi,Vietnamese
545994,Vietnamese Red Snapper with Noodles,Vietnamese
482702,Vietnamese Meatballs with Vermicelli,Vietnamese
992243,Vietnamese Shrimp Salad with Noodles,Vietnamese
202573,Canned Sardine Banh Mi,Vietnamese
21787,Mango & Avocado Spring Rolls With Peanut Sauce,Vietnamese
471824,Vietnamese Sandwich,Vietnamese
880982,Hot Vietnamese Beef Salad,Vietnamese
44561,Vietnamese Steak Sandwich,Vietnamese
543235,Asian Style Roasted Pork Meatballs atop Vietnamese Salad,Vietnamese
498954,Vietnamese Ground Pork In Tomato Sauce,Vietnamese
568851,Vietnamese Spring Rolls {a How-To},Vietnamese
505113,Vegetable Quinoa Spring Rolls,Vietnamese
701799,Spicy Meatball Banh Mi,Vietnamese
607940,Spring Rolls,Vietnamese
990806,Banh Mi Meatball Snack Dinner,Vietnamese
20200,Swiss Chard And Spicy Peanut Sauce Spring Rolls,Vietnamese
9955,Vietnamese Noodle Soup,Vietnamese
560644,Sriracha Soy Vegetable Spring Rolls,Vietnamese
602578,Pho Ga - Vietnamese Chicken Noodle Soup,Vietnamese
1087316,Salmon & Spinach Spring Rolls,Vietnamese
899709,Zucchini Noodle Pho from The Big 10 Paleo Spiralizer Cookbook,Vietnamese
21039,Pho Ga (Vietnamese Chicken Noodle Soup with Ginger),Vietnamese
684448,Vietnamese Pork and Pumpkin Soup,Vietnamese
34560,Bún Chay (Vietnamese Vegetarian Noodle Salad),Vietnamese
512109,Crunchy Veggie & Black Bean Spring Rolls,Vietnamese
626736,Seared Tofu Banh Mi Sandwiches,Vietnamese
527907,Chicken Avocado Spring Rolls with Hoisin Nut Dip,Vietnamese
429839,Vietnamese Crunchy Chicken Salad,Vietnamese
44598,Shiitake Banh Mi Salad,Vietnamese
1162891,Fresh Spring Rolls,Vietnamese
200720,Dinner Tonight: Everyday Fried Noodles (Tian Tian Chao Mian),Vietnamese
82979,Lamb Meatball Banh Mi,Vietnamese
485512,Easy Pho,Vietnamese
93186,Vietnamese Chicken Salad,Vietnamese
39607,Beef And Pinto Bean Pho,Vietnamese
664830,"Vietnamese Beef-Noodle Soup With Asian Greens, Okay Vietnamese/japanese",Vietnamese
757109,How to make Vietnamese Spring Rolls,Vietnamese
321223,Vietnamese Pho,Vietnamese
34551,Vegetarian Pho,Vietnamese
1087315,Vietnamese Gressingham Duck,Vietnamese
483103,Vietnamese Fresh Rolls with Shrimp,Vietnamese
756986,Roasted Sugar Snap Pea & Scallion Spring Rolls with Tahini Sauce,Vietnamese
747612,Leftover Roast Turkey Pho,Vietnamese
41505,Banh Mi,Vietnamese
822254,Vietnamese Chicken Sandwich with Pickled Vegetables (Bánh Mì),Vietnamese
759678,Vegetarian Pho (Vietnamese Noodle Soup),Vietnamese
1087825,Vietnamese chicken wraps,Vietnamese
840271,Vietnamese Grapefruit & Pork Salad (Pork Goi Buoi),Vietnamese
247955,BÃ¡nh XÃ¨o (Savoury Vietnamese Crepes Stuffed with Shrimp and Mushrooms),Vietnamese
93028,Vietnamese Cabbage and Chicken Salad,Vietnamese
498139,Vietnamese Lemongrass Beef with Vermicelli,Vietnamese
719156,Easy Vietnamese Lettuce wraps,Vietnamese
98252,Pork Meatball Banh Mi,Vietnamese
1119949,Vegetable Spring Rolls with Peanut Sauce,Vietnamese
34473,Shrimp Spring Rolls And Lettuce Wraps,Vietnamese
664835,Vietnamese Noodle Salad With Tofu,Vietnamese
670572,Beef Pho Noodle Soup,Vietnamese
690298,Homemade Spring Rolls,Vietnamese
6817,Vietnamese Tilapia With Turmeric & Dill,Vietnamese
882247,"Shrimp Zoodle Spring Roll Bowl (Paleo, Whole30, GF, Soy-Free + Dairy-Free)",Vietnamese
545316,"Asian Beef ""Spring Rolls",Vietnamese
577771,Sexy Cabbage (+ Cilantro-Lime Carrot and Cabbage Spring Rolls),Vietnamese
577803,Sesame Crusted Avocado and Cabbage Spring Rolls,Vietnamese
495572,Grilled Veggie Banh Mi Sandwiches,Vietnamese
696206,Meatball Banh Mi,Vietnamese
510493,Vegetable Spring Rolls with Peanut Sauce,Vietnamese
759328,Vietnamese Hot Pot,Vietnamese
577598,Grilled Asparagus and Chili-Orange Quinoa Spring Rolls,Vietnamese
511604,Spring Rolls With Salmon,Vietnamese
550072,"Deconstructed Vietnamase Chicken, Avocado + Lemongrass Spring Roll Salad",Vietnamese
704232,"Sweet Potato, Kale + Quinoa Spring Rolls",Vietnamese
558699,Fresh Spring Rolls with Peanut Dipping Sauce,Vietnamese
525167,Vietnamese Caramel Pork Stir Fry,Vietnamese
577574,Grilled Mango and Spicy Cabbage Spring Rolls,Vietnamese
604706,Healthy Lunchbox s: Vegetable Spring Rolls with Lightened Up Peanut Sauce,Vietnamese
758919,Live Spring Rolls with Lemon-Ginger Dipping Sauce,Vietnamese
483557,Shrimp Pho – Vietnamese Noodle Soup,Vietnamese
496844,Chicken Pho,Vietnamese
523615,Beef Pho (Vietnamese Noodle Soup),Vietnamese
200328,Serious Salads: Vietnamese Shrimp and Quinoa Salad,Vietnamese
812229,Vietnamese Shrimp Edamame Salad,Vietnamese
249074,Vietnamese Caramel Salmon Banh Mi,Vietnamese
478316,How to make: Vietnamese chicken salad,Vietnamese
499526,Vietnamese Noodle Salad With Caramelized Pork,Vietnamese
832002,Slow-Cooker Banh Mi Rice Bowls,Vietnamese
21665,Mandarin Orange And Avocado Spring Rolls,Vietnamese
867475,Chile-Marinated Pork With Vietnamese Brussels Sprouts,Vietnamese
247972,Vietnamese Summer Roll Salad,Vietnamese
549701,Vietnamese Shaken Beef Bowl,Vietnamese
751851,Pho to Go,Vietnamese
535680,Roasted Shrimp Quinoa Spring Rolls,Vietnamese
557417,Chicken Avocado Salad Spring Rolls,Vietnamese
556721,Fresh Veggie Spring Rolls (Nim Chow) with Honey Peanut Hoisin Sauce,Vietnamese
507065,Easy Veggie Spring Rolls with Spicy Coconut Curry Sauce,Vietnamese
76356,Faux Pho,Vietnamese
982146,Vietnamese Spring Roll Salad,Vietnamese
1001479,Mango Avocado Spring Rolls (with Peanut Sauce),Vietnamese
589697,Vietnamese Pork and Shrimp Spring Rolls,Vietnamese
618467,"Roasted Brussels Sprouts with Mint, Cilantro and Vietnamese Style Dressing",Vietnamese
589804,Vietnamese Spring Rolls – Pineapple Salad – In Two Ways,Vietnamese
506940,Vietnamese Vermicelli Bowl (“Bun”),Vietnamese
81380,Vietnamese Shaking Beef (bo Luc Lac),Vietnamese
36749,Fresh Spring Rolls,Vietnamese
542206,How to Make Vietnamese Fresh Spring Rolls – Step by Step,Vietnamese
15421,Turkey Pho,Vietnamese
718512,Easy Vegetarian Pho,Vietnamese
794052,How To Make Vietnamese Spring Rolls,Vietnamese
607910,Vietnamese Style Grilled Lemongrass Pork,Vietnamese
478234,How to cook: Fried spring rolls with pork filling,Vietnamese
482552,Vietnamese Chicken Soup (Faux Pho),Vietnamese
794056,Bo Luc Lac – Vietnamese Shaking Beef,Vietnamese
695041,Vietnamese Mango & Chicken Salad,Vietnamese
8492,"Spaghetti Squash, Shitake, Arugula And Pistachio Spring Roll",Vietnamese
25765,Spring Rolls + Hot Sauce,Vietnamese
494986,Asparagus and Avocado Spring Rolls with Citrus Dipping Sauce,Vietnamese
584179,Vietnamese Caramel Pork (The Kids Cook Monday),Vietnamese
630039,Aromatic Vietnamese beef broth,Vietnamese
248983,Banh Mi Chicken Salad,Vietnamese
195531,Grilling: Steak Banh Mi,Vietnamese
988214,Vietnamese Spring Rolls with Peanut Sauce,Vietnamese
512571,How to Make Homemade Spring Rolls with Peanut Sauce,Vietnamese
762774,Authentic Pho,Vietnamese
479017,Meatless Monday: Vietnamese Eggplant and Leek Lettuce Wraps,Vietnamese
195537,Grilling: Vietnamese Pork with Vermicelli Noodles and Nuoc Cham,Vietnamese
34537,Shrimp Lettuce Wraps and Spring Rolls,Vietnamese
535910,Shrimp Spring Rolls with Hoisin Peanut Dip,Vietnamese
479317,"The Balanced Diet: Rice Noodle Salad with Kale, Scallions, and Nuoc Cham Sauce",Vietnamese
716217,"Vietnamese Pancakes with Vegetables, Herbs and a Fragrant Dipping Sauce (Bánh Xèo)",Vietnamese
496974,Slow Cooker Bánh Mì Vietnamese Sandwich,Vietnamese
549059,Vietnamese Salad Rolls with Peanut Dipping Sauce,Vietnamese
602455,Vietnamese Shrimp Mango Summer Rolls,Vietnamese
529448,Easy Vietnamese Turkey Meatballs (with gluten free option!),Vietnamese
779987,Chinese Salad Spring Rolls,Vietnamese
549740,Mahi Mahi Banh Mi with Spicy Curried Mayo + Fried Eggs,Vietnamese
737537,Chicken Pho,Vietnamese
597652,Pho,Vietnamese
93663,Vegetarian Fresh Spring Rolls,Vietnamese
225048,Vietnamese veggie hotpot,Vietnamese
695567,Vietnamese Mango & Chicken Pizz’alad,Vietnamese
795109,Vietnamese Beef Cabbage Wraps,Vietnamese
11366,Sexy Spring Rolls,Vietnamese
41552,Shrimp Spring Rolls (vietnamese Roll Recipe),Vietnamese
940394,Vietnamese Shaking Beef (Bo Luc Lac),Vietnamese
93065,Awesome Vietnamese Chicken Salad,Vietnamese
697330,Vietnamese Chicken & Noodle Salad,Vietnamese
